{
  "format": "qtap-theme",
  "formatVersion": 1,
  "id": "rains",
  "name": "Rains",
  "description": "A Claude-inspired warm theme with clean charcoal dark mode, parchment light mode, and orange-amber accents",
  "version": "1.3.13",
  "author": "Foundry-9 LLC",
  "license": "MIT",
  "supportsDarkMode": true,
  "tags": [
    "rains",
    "brown",
    "warm",
    "earthy",
    "cozy"
  ],
  "tokensPath": "tokens.json",
  "stylesPath": "styles.css",
  "fonts": [
    {
      "family": "Nunito Sans",
      "src": "fonts/NunitoSans-Regular.woff2",
      "weight": "400",
      "style": "normal",
      "display": "swap"
    },
    {
      "family": "Nunito Sans",
      "src": "fonts/NunitoSans-Italic.woff2",
      "weight": "400",
      "style": "italic",
      "display": "swap"
    },
    {
      "family": "Fira Code",
      "src": "fonts/FiraCode-Regular.woff2",
      "weight": "400",
      "style": "normal",
      "display": "swap"
    },
    {
      "family": "Fira Code",
      "src": "fonts/FiraCode-Bold.woff2",
      "weight": "700",
      "style": "normal",
      "display": "swap"
    }
  ]
}
