{
  "format": "qtap-theme",
  "formatVersion": 1,
  "id": "earl-grey",
  "name": "Earl Grey",
  "description": "A high-contrast dark theme inspired by modern AI chat interfaces, with pure black sidebar, charcoal main area, and clean minimal styling",
  "version": "1.3.9",
  "author": "Foundry-9 LLC",
  "license": "MIT",
  "supportsDarkMode": true,
  "tags": [
    "earl-grey",
    "dark",
    "minimal",
    "high-contrast",
    "modern"
  ],
  "tokensPath": "tokens.json",
  "stylesPath": "styles.css",
  "fonts": [
    {
      "family": "Rethink Sans",
      "src": "fonts/RethinkSans-latin.woff2",
      "weight": "400 700",
      "style": "normal",
      "display": "swap"
    },
    {
      "family": "Rethink Sans",
      "src": "fonts/RethinkSans-latin-ext.woff2",
      "weight": "400 700",
      "style": "normal",
      "display": "swap"
    }
  ]
}
