{
  "format": "qtap-theme",
  "formatVersion": 1,
  "id": "art-deco",
  "name": "Art Deco",
  "description": "The geometry of elegance, the precision of grandeur. Navy-and-gold palette evoking the Chrysler Building lobby at dusk — opulent but disciplined. Geometric sans-serif headings with wide tracking, elegant serif body text, and gold accents throughout. Light mode is ivory and gold leaf; dark mode is midnight and burnished brass.",
  "version": "1.0.12",
  "author": "Foundry-9 LLC",
  "license": "MIT",
  "supportsDarkMode": true,
  "tags": [
    "art-deco",
    "gold",
    "navy",
    "geometric",
    "elegant",
    "opulent"
  ],
  "tokensPath": "tokens.json",
  "stylesPath": "styles.css",
  "fonts": [
    {
      "family": "Raleway",
      "src": "fonts/Raleway-Light.woff2",
      "weight": "300",
      "style": "normal",
      "display": "swap"
    },
    {
      "family": "Raleway",
      "src": "fonts/Raleway-Regular.woff2",
      "weight": "400",
      "style": "normal",
      "display": "swap"
    },
    {
      "family": "Raleway",
      "src": "fonts/Raleway-Medium.woff2",
      "weight": "500",
      "style": "normal",
      "display": "swap"
    },
    {
      "family": "Raleway",
      "src": "fonts/Raleway-SemiBold.woff2",
      "weight": "600",
      "style": "normal",
      "display": "swap"
    },
    {
      "family": "Raleway",
      "src": "fonts/Raleway-Bold.woff2",
      "weight": "700",
      "style": "normal",
      "display": "swap"
    },
    {
      "family": "Cormorant Garamond",
      "src": "fonts/CormorantGaramond-Regular.woff2",
      "weight": "400",
      "style": "normal",
      "display": "swap"
    },
    {
      "family": "Cormorant Garamond",
      "src": "fonts/CormorantGaramond-Italic.woff2",
      "weight": "400",
      "style": "italic",
      "display": "swap"
    },
    {
      "family": "Cormorant Garamond",
      "src": "fonts/CormorantGaramond-Medium.woff2",
      "weight": "500",
      "style": "normal",
      "display": "swap"
    },
    {
      "family": "Cormorant Garamond",
      "src": "fonts/CormorantGaramond-MediumItalic.woff2",
      "weight": "500",
      "style": "italic",
      "display": "swap"
    },
    {
      "family": "Cormorant Garamond",
      "src": "fonts/CormorantGaramond-SemiBold.woff2",
      "weight": "600",
      "style": "normal",
      "display": "swap"
    }
  ]
}
